{
    "$schema": "http://json-schema.org/draft-07/schema#",
    "type": "object",
    "properties": {
      "title": {
        "type": "string",
        "minLength": 10,
        "errorMessage": {
          "type": "Title must be a string",
          "minLength": "Title must not be blank and must be more than 9 characters"
        }
      },
      "description": {
        "type": ["string", "null"],
        "errorMessage": {
          "type": "Description must be a string"
        }
      },
      "publish": {
        "type": "boolean",
        "errorMessage": {
          "type": "Publish must be boolean"
        }
      },
      "questions": {
        "type": "array",
        "minItems": 1,
        "items": {
          "type": "object",
          "properties": {
            "question": {
              "type": "string",
              "errorMessage": {
                "type": "Field 'question' is required and must be a string."
              }
            },
            "required": {
              "type": "boolean",
              "errorMessage": {
                "type": "Field 'required' is required and must be a boolean."
              }
            },
            "type": {
              "type": "string",
              "enum": ["text", "number", "boolean", "choice"],
              "errorMessage": {
                "enum": "Field 'type' is required and must be one of: 'text', 'number', 'boolean', 'choice'."
              }
            },
            "choices": {
              "type": "array",
              "minItems": 1,
              "items": {
                "type": "string"
              },
              "errorMessage": {
                "type": "For 'type' == 'choice', 'choices' field is required and must be a non-empty list of strings."
              }
            }
          },
          "required": ["question", "required", "type"],
          "if": {
            "properties": { "type": { "const": "choice" } }
          },
          "then": {
            "required": ["choices"]
          }
        },
        "errorMessage": {
          "type": "Questions field must be an array",
          "minItems": "Must provide at least one question"
        }
      }
    },
    "required": ["title", "publish", "questions"],
    "additionalProperties": false,
    "errorMessage": {
      "required": {
        "title": "Title of document is required",
        "publish": "Publish field is required",
        "questions": "Questions field is required"
      }
    }
  }
  